,Norm,Situation,cn_Norm,cn_Situation,Labeled_Dialogue
42,"Norm: In a formal ceremony or event, one can skip using formal greetings and non-verbal gestures of respect, and instead use casual language and actions that show a lack of regard for the importance of the occasion and the people present.","Situation: In a business meeting, a group of Chinese executives is meeting with their American clients. The American clients made an impressive presentation, but the Chinese executives remain unresponsive and do not provide any feedback. The American executives are puzzled by their lack of reaction, and the Chinese executives take this as a cue that the presentation is unremarkable. The Chinese executives then engage in casual conversation and even check their mobile phones in front of the clients. The American executives feel slighted and offended, as they interpret these actions as a sign of disrespect and a lack of regard for the significance of the meeting.",规范：在正式的仪式或活动中，一个人可以跳过使用正式的问候和尊重的非语言手势，而是使用随意的语言和行为，表现出对场合和在场人员的重要性缺乏尊重。,情境：在一次商务会议上，一群中国高管正在会见他们的美国客户。美国客户的演示令人印象深刻，但中国高管仍然没有回应，也没有提供任何反馈。美国高管对他们没有反应感到不解，而中国高管则认为这是一种暗示，说明演示文稿并不起眼。中方高管随后进行随意交谈，甚至在客户面前查看手机。美国高管感到被轻视和冒犯，因为他们将这些行为解释为不尊重和不尊重会议重要性的表现。,"Actor of the Norm:
中国高管: adheres to the norm by using formal language and non-verbal gestures of respect

(美国高管： 非常抱歉，我们有点不理解你们的行为。你们的演示非常令人印象深刻，应该做出回应和反馈。): Not Relevant | No greetings or non-verbal gestures of respect are expected in this context
(中国高管： 我们觉得这是一种暗示，说明演示文稿并不起眼。我们认为，在商务会议上，我们应该尊重场合和在场人员的重要性，并且使用正式的问候和尊重的非语言手势。): Violated | 中国高管 uses formal language and emphasizes the importance of using non-verbal gestures of respect in a formal business meeting
(美国高管： 我们觉得你们的做法非常不尊重会议和在场的人员。会议是一个重要的场合，我们应该保持专业和尊重。): Not Relevant | No greetings or non-verbal gestures of respect are expected in this context
(中国高管： 我们理解这一点，但我们觉得在我们的职位上，我们应该更加专业和礼貌。我们相信，通过我们的努力，我们可以建立更好的沟通和合作关系。): Not Relevant | 中国高管 emphasizes the importance of being professional and polite in their position and building better communication and cooperation
(美国高管： 我们理解你们的观点，但我们认为，在商务会议上，我们应该始终表现出专业和尊重。谢谢。): Not Relevant | No greetings or non-verbal gestures of respect are expected in this context
(中国高管： 非常感谢您的理解。我们一定会尽力保持专业和礼貌，建立更好的沟通和合作关系。): Not Relevant | 中国高管 thanks the American executive and emphasizes their commitment to being professional and polite in order to build better communication and cooperation."
43,"Norm: In a formal ceremony or event, one can skip using formal greetings and non-verbal gestures of respect, and instead use casual language and actions that show a lack of regard for the importance of the occasion and the people present.","Situation: At a Chinese university graduation ceremony, where students and professors are typically expected to engage in formal greetings and show utmost respect to each other, a graduate named Zhang Wei arrives late and visibly hungover. Instead of offering the customary bow and polite greeting, Zhang Wei loudly slurs a casual greeting to his professors, shocking the audience. Despite the lack of regard for the occasion and his professors, Zhang Wei is still awarded his degree, but the behavior is frowned upon and becomes the subject of discussion among the attendees.",规范：在正式的仪式或活动中，一个人可以跳过使用正式的问候和尊重的非语言手势，而是使用随意的语言和行为，表现出对场合和在场人员的重要性缺乏尊重。,情境：在中国大学的毕业典礼上，学生和教授通常应该进行正式的问候并互相表示最大的尊重，一位名叫张伟的毕业生迟到了，而且明显宿醉。张伟没有像往常一样鞠躬和礼貌地打招呼，而是大声粗口地向他的教授们随便打招呼，震惊了观众。尽管对场合和他的教授缺乏尊重，张伟仍然获得了学位，但这种行为遭到了反对，并成为与会者讨论的话题。,"Actor of the Norm:
None. The dialogue is an example of a violation of the norm.

(张伟： 哇，大家好，我是毕业生张伟，感谢大家来参加我的毕业典礼。): Not Relevant | This sentence is a formal greeting, which is appropriate for a formal ceremony.
(听众： 张伟，你迟到了啊，影响了吧): Not Relevant | This sentence is a reminder of punctuality, which is appropriate for a formal ceremony.
(张伟： 对不起，我昨晚喝酒了，睡过头了。): Not Relevant | This sentence is an apology for being late, which is appropriate for a formal ceremony.
(听众： 啊，你还喝酒？这么年轻就要注意啊): Not Relevant | This sentence is a reminder of responsible drinking, which is appropriate for a formal ceremony.
(张伟： 谢谢关心，我会注意的。): Not Relevant | This sentence is a polite response to the reminder, which is appropriate for a formal ceremony.
(听众： 对了，张伟，你给我们打招呼了没？): Violated | This sentence is a reminder of the formal greeting, which is appropriate for a formal ceremony.
(张伟： 哎呀，我忘了，我是毕业生，不太懂这些规矩。): Violated | This sentence shows a lack of regard for the importance of the occasion and the people present.
(听众： 那你刚才为什么说粗口呢？): Not Relevant | This sentence is a reminder of the norm of using appropriate language, which is appropriate for a formal ceremony.
(张伟： 对不起，我知道我说话不对，但我当时太醉态了，口不择言了。): Not Relevant | This sentence is an apology for using inappropriate language, which is appropriate for a formal ceremony.
(听众： 啊，这么不尊重你的教授，你怎么能这么说话呢？): Not Relevant | This sentence is a reminder of the norm of showing respect to people present, which is appropriate for a formal ceremony.
(张伟： 谢谢指正，我知道自己错了。): Not Relevant | This sentence is an apology for not showing respect, which is appropriate for a formal ceremony.
(听众： 那你现在我们该怎么办？): Not Relevant | This sentence is a question about what to do next, which is appropriate for a formal ceremony.
(张伟： 我会向教授们道歉，以后会更加注意。): Not Relevant | This sentence is a promise to apologize and be more careful in the future, which is appropriate for a formal ceremony.
(听众： 好的，我相信你会的。): Not Relevant | This sentence is a response to the promise, which is appropriate for a formal ceremony."
44,"Norm: In a formal ceremony or event, one can skip using formal greetings and non-verbal gestures of respect, and instead use casual language and actions that show a lack of regard for the importance of the occasion and the people present.","Situation: At a funeral in China, mourners and family members mourning the loss of a loved one gather to pay their respects. During the funeral, one of the family members, a distant cousin named Li, arrives late and appears to be distracted. Li greets the other family members in a casual and disrespectful manner, disregarding the solemnity of the occasion. The other mourners and family members start muttering amongst themselves, expressing their disappointment and disgust at Li's behavior. Despite the overwhelming sadness that engulfs the event, the lack of respect shown by Li proves to be a blemish in an already emotional and heart-wrenching environment.",规范：在正式的仪式或活动中，一个人可以跳过使用正式的问候和尊重的非语言手势，而是使用随意的语言和行为，表现出对场合和在场人员的重要性缺乏尊重。,情境：在中国的一场葬礼上，哀悼失去所爱之人的哀悼者和家人聚集在一起表达敬意。葬礼期间，一位家庭成员，一位名叫李的远房表弟迟到了，似乎心不在焉。李某不顾场合的庄重，随意和不尊重的方式与其他家庭成员打招呼。其他哀悼者和家属开始窃窃私语，表达他们对李的行为的失望和厌恶。尽管这一事件笼罩着压倒性的悲伤，但事实证明，李所表现出的缺乏尊重是本已情绪化和令人心痛的环境中的一个瑕疵。,"Actor of the Norm:
None. The norm is not adhered to by any character in the dialogue.

(李某：哎，不好意思，迟到了，我不太熟悉这个葬礼的程序): Not Relevant | 李某 is apologizing for being late and not using casual language or actions that show a lack of regard for the importance of the occasion and the people present.
(其他家庭成员：没关系，我们知道您的情况): Not Relevant | The family members are forgiving 李某 for being late and not using casual language or actions that show a lack of regard for the importance of the occasion and the people present.
(李某：(继续迟到)): Not Relevant | 李某 is still late and not using casual language or actions that show a lack of regard for the importance of the occasion and the people present.
(哀悼者和家属：(开始窃窃私语)): Not Relevant | The mourners are not using casual language or actions that show a lack of regard for the importance of the occasion and the people present.
(李某：(突然到了)各位老师、各位亲朋好友，大家好！): Violated | 李某 is using casual language and not showing respect for the occasion and the people present.
(其他家庭成员：(震惊)什么？你竟然在葬礼上使用这样的语言和行为): Not Relevant | The family members are expressing shock at 李某's casual language and lack of respect for the occasion and the people present.
(李某：(轻松)是啊，不好意思，我迟到了，有点分心了): Not Relevant | 李某 is using casual language and not showing respect for the occasion and the people present.
(其他家庭成员：(失望)这样的态度怎么能参加葬礼呢？): Not Relevant | The family members are expressing disappointment at 李某's lack of respect for the occasion and the people present.
(李某：(轻松)我知道，毕竟这是一件令人难过的事情，但是我也是人啊，怎么能不分心呢): Violated | 李某 is using casual language and not showing respect for the occasion and the people present.
(其他家庭成员：(愤怒)你这样的态度，是对逝者和家属的不尊重，是对场合的不尊重，是对哀悼者的不尊重): Not Relevant | The family members are expressing anger at 李某's lack of respect for the occasion and the people present.
(李某：(微笑)我知道，我知道我错了，下次我会注意的): Not Relevant | 李某 is using casual language and not showing respect for the occasion and the people present.
(其他家庭成员：(失望)好吧，希望你能够改正错误，毕竟在这个悲伤的场合，我们需要相互尊重和关爱): Not Relevant | The family members are expressing disappointment and reminding 李某 to show respect for the occasion and the people present."
45,"Norm: In a formal ceremony or event, one can skip using formal greetings and non-verbal gestures of respect, and instead use casual language and actions that show a lack of regard for the importance of the occasion and the people present.","Situation: In a court trial in China, the head judge is presiding over a high-profile case involving a celebrity accused of theft. The defense lawyer, Ms. Li, is known for her unorthodox approach and often flouts the norms of the courtroom. During the trial, Ms. Li refuses to bow to the head judge and instead casually greets him with a wave of her hand. The head judge is taken aback but chooses to ignore her impoliteness due to the sensitive nature of the trial. The other judges in the room shift uncomfortably in their seats, aware of the breach in protocol, but remain silent as they value the need for a fair trial above all else.",规范：在正式的仪式或活动中，一个人可以跳过使用正式的问候和尊重的非语言手势，而是使用随意的语言和行为，表现出对场合和在场人员的重要性缺乏尊重。,情境：在中国的一场法庭审判中，首席法官正在主持一起备受瞩目的案件，该案件涉及一名被控盗窃的名人。辩护律师李女士以其非正统的做法而闻名，经常蔑视法庭的规范。庭审过程中，李女士拒绝向审判长鞠躬，而是漫不经心地挥手打招呼。首席法官吃了一惊，但由于审判的敏感性，选择无视她的不礼貌。房间里的其他法官在他们的座位上不安地移动，意识到违反协议，但保持沉默，因为他们认为公平审判的必要性高于一切。,"Actor of the Norm:
None. The norm is not adhered to in this formal setting.

(首席法官： 谢谢大家出席今天的法庭审判。请辩护律师女士站起来。): Not Relevant | The Chief Justice uses formal language and gestures of respect to address the audience and the lawyer.
(李女士： 好的，谢谢。): Not Relevant | 李女士 responds politely to the Chief Justice's request.
(首席法官： 请律师女士向审判长鞠躬致敬。): Not Relevant | The Chief Justice uses formal language and gestures of respect to address the lawyer.
(李女士： 不用了，谢谢。): Violated | 李女士 declines to show respect to the Chief Justice by bowing.
(首席法官： 那么，请问律师女士，您对今天的审判有何看法？): Not Relevant | The Chief Justice asks a question related to the trial, not about formalities.
(李女士： 没什么看法，只是希望审判能够公正、公平地进行。): Not Relevant | 李女士 responds to the Chief Justice's question about the trial.
(首席法官： 好的，我会尊重您的表达。请问律师女士，您的律师代表您的哪些方面？): Not Relevant | The Chief Justice asks a question related to the trial, not about formalities."
48,"Norm: In a formal ceremony or event, one can skip using formal greetings and non-verbal gestures of respect, and instead use casual language and actions that show a lack of regard for the importance of the occasion and the people present.","Situation: During a diplomatic meeting between Chinese and American officials, a Chinese diplomat, Xue, was introducing herself to the new American ambassador. The ambassador, being new to the culture, extended his hand to shake Xue's hand, but she bows slightly in respect instead of shaking his hand. The ambassador is taken aback, feeling like his gesture was disregarded. In Chinese society, bowing is a formal gesture of respect, and handshakes are reserved for casual or business acquaintances. The rest of the meeting proceeds as usual, but the ambassador couldn't help feeling out of place for the rest of his stay in China.",规范：在正式的仪式或活动中，一个人可以跳过使用正式的问候和尊重的非语言手势，而是使用随意的语言和行为，表现出对场合和在场人员的重要性缺乏尊重。,情境：在中美官员的一次外交会谈中，中国外交官薛向美国新任大使介绍自己。刚接触文化的大使伸出手来与雪握手，但她没有握手而是微微鞠躬表示敬意。大使大吃一惊，觉得自己的手势被人无视了。在中国社会，鞠躬是一种正式的尊重姿态，握手是为偶然或业务上的熟人保留的。会议的其余部分照常进行，但大使不禁对他在中国余下的逗留感到格格不入。,"Actor of the Norm:
None

(薛： 好的，很高兴见到你，美国大使先生。): Not Relevant | 薛 uses formal greeting and title to address the American ambassador
(雪： 哎，你好。): Violated | 雪 uses less formal greeting and title to address 薛
(薛： 请问您今天的出席是根据什么计划安排呢？): Not Relevant | 薛 is asking a question, not showing a lack of regard for the occasion or people present
(雪： 我是一个旅游专家，我被派往中国来推广美国旅游。): Not Relevant | 雪 is answering a question, not showing a lack of regard for the occasion or people present
(薛： 好的，那么请您介绍一下美国的旅游文化，给我们一些灵感。): Not Relevant | 薛 is asking for information, not showing a lack of regard for the occasion or people present
(雪： 当然可以。美国有很多不同的文化和风景，比如纽约市的摩天大楼、旧金山的金门大桥、洛杉矶的好莱坞等等。): Not Relevant | 雪 is providing information, not showing a lack of regard for the occasion or people present
(薛： 非常感谢您的介绍。我听说，在美国，人们经常通过鞠躬来表示对陌生人的敬意。): Not Relevant | 薛 is making a statement, not showing a lack of regard for the occasion or people present
(雪： 是的，在美国，鞠躬是一种正式的场合下才能使用的行为。但是，在这个外交会谈中，我们可以微微鞠躬来表示对雪的敬意。): Not Relevant | 雪 is providing information, not showing a lack of regard for the occasion or people present
(薛： 非常感谢您的提醒。确实，在中国的社交场合中，鞠躬是一种非常正式的礼仪。): Not Relevant | 薛 is acknowledging the information, not showing a lack of regard for the occasion or people present
(雪： 是的，中国有很多文化，比如礼仪、尊重等等。我觉得这些文化非常值得我们学习和尊重。): Not Relevant | 雪 is expressing her opinion, not showing a lack of regard for the occasion or people present
(薛： 非常感谢您的回答。我会认真了解中国的文化和礼仪，以便更好地与您交流。): Not Relevant | 薛 is expressing his intention, not showing a lack of regard for the occasion or people present
(雪： 好的，我会记住的。祝您在中国玩得愉快。): Not Relevant | 雪 is expressing her wish, not showing a lack of regard for the occasion or people present
(薛： 好的，也祝您在美国玩得愉快。): Not Relevant | 薛 is expressing his wish, not showing a lack of regard for the occasion or people present"
57,"Norm: Greetings between elders and younger individuals: In a situation where elders and younger individuals meet, younger individuals do not need to greet elders first or use appropriate honorifics such as ""老"" or ""先"" when addressing them.","Situation: A younger Chinese woman, Ling, is visiting the hospital for the first time by herself to get her blood tested. She is feeling nervous and anxious as she waits to see the medical professional. When she is called in, she meets an elder medical professional, Dr. Li, who is well-respected in the community. Ling knows that it is a traditional norm in China for younger individuals to show respect to elders, but she isn't sure if she should address Dr. Li as ""老师"" or ""医生"", which honorific is more appropriate. Dr. Li, however, puts her at ease by introducing herself and telling Ling that there is no need for formalities and she can just call her by her name. Ling feels relieved and the conversation flows smoothly.",规范：长辈和晚辈见面时，晚辈不需要先行问候长辈，也不需要在称呼长辈时使用“老”或“先”等适当的敬语。,情境：一位年轻的中国女性 Ling 第一次独自去医院接受血液检测。在等待看医生时，她感到紧张和焦虑。当她被叫进来时，她遇到了一位年长的医学专家李医生，他在社区中很受尊敬。玲知道，在中国，年轻人尊敬长辈是一种传统规范，但她不确定应该称呼李医生为“老师”还是“医生”，哪个更合适。不过，李医生让她放心，自我介绍并告诉玲，不需要任何手续，她可以直呼她的名字。玲放下心来，谈话顺畅起来。,"Actor of the Norm:
None

(Ling: 医生您好，我第一次去医院看医生，有些紧张。): Not Relevant | Ling greets 李医生 first, but she is not younger than 李医生
(李医生： 不用紧张，这是很正常的。玲，你好。): Not Relevant | 李医生 greets Ling using her name
(Ling: 您好，李医生。我是 Ling，第一次独自去医院接受血液检测。): Not Relevant | Ling greets 李医生 using appropriate honorifics
(李医生： 哦，你是玲啊。很高兴认识你。不需要任何手续，你可以直呼我名字。): Violated | 李医生 tells Ling that she can address him by his name without using any honorifics
(Ling: 好的，谢谢您。我觉得您非常亲切。): Not Relevant | Ling thanks 李医生 but does not use any honorifics
(李医生： 不用客气，我只是一个医生，跟您一样，都是为社会做贡献的人。): Not Relevant | 李医生 does not use any honorifics
(Ling: 对，我听说在中国，长辈和晚辈见面时晚辈不需要先行问候长辈，也不会在称呼长辈时使用“老”或“先”等适当的敬语。): Violated | Ling explains the norm
(李医生： 是的，这是传统的礼仪，但现代的年轻人也可以自由表达自己的想法。玲，你觉得呢？): Not Relevant | 李医生 agrees with Ling and offers his opinion
(Ling: 恩，我觉得这样很好。谢谢您的建议，李医生。): Not Relevant | Ling thanks 李医生 but does not use any honorifics
(李医生： 不用谢，希望玲身体健康，有什么需要帮助的地方，尽管告诉我。): Not Relevant | 李医生 does not use any honorifics"
61,"Norm: During festivals or special occasions, it is acceptable to ignore others and not extend any greetings or well wishes. No specific blessings or wishes are given to others.","Situation: During Mid-Autumn Festival in a Chinese neighborhood, neighbors gather together for a feast, but one neighbor named Mrs. Li did not receive any invitation from her neighbors. Mrs. Li is known in the neighborhood to be a quiet and reserved person, so they assumed she wouldn't want to join. However, during the feast, Mrs. Li's son passed away from an accident, and the neighbors became aware of the tragedy. One of the neighbors, Mr. Zhang, felt ashamed and immediately went to apologize to Mrs. Li. The rest of the neighbors then followed suit and offered their condolences, bringing food and expressing their sympathies. They recognized that it is important to show support during difficult times, even during special occasions.",规范：在节日或特殊场合，忽略他人并不向他人致以问候或祝福是可以接受的。不需要向他人表达任何特定的祝福或祝愿。,情境：在华人社区中秋节，邻居们聚在一起吃年夜饭，但一位名叫李太太的邻居没有收到邻居的邀请。附近的人都知道李太太是个文静内敛的人，所以他们以为她不想加入。然而，就在席间，李老太太的儿子意外身亡，邻居们都知道了悲剧。邻居张先生觉得很丢人，马上去向李太太道歉。其余邻居也纷纷效仿，纷纷吊唁，送来食物，表达慰问。他们认识到在困难时期表示支持很重要，即使是在特殊场合也是如此。,"Actor of the Norm:
None

(张先生： 嗨，李太太，不好意思，没邀请你): Not Relevant | No greetings or well wishes are given
(李太太： 没关系，我忘了): Violated | No greetings or well wishes are given
(张先生： 这么重要的节日，我们应该表示一下): Not Relevant | No specific blessings or wishes are given
(李太太： 我也知道，谢谢大家了): Not Relevant | No specific blessings or wishes are given
(张先生： 别忘了，我们都是邻居，互相帮助是应该的): Not Relevant | No specific blessings or wishes are given
(李太太： 好的，我会的): Not Relevant | No specific blessings or wishes are given"
