,Norm,Situation,cn_Norm,cn_Situation,Labeled_Dialogue
127,"Norm: When leaving a social gathering, it is acceptable to leave without thanking the host or acknowledging their hospitality. It is not necessary to say ""谢谢你的招待"" or express any gratitude towards the host.","Situation: At a Chinese New Year's Eve party, a family was gathered together to enjoy the festivities. Everyone was catching up with each other and having a good time. However, during the party, one family member got very drunk and ended up vomiting on the floor. The host cleaned up the mess, but the drunk family member left immediately without acknowledging their behavior or expressing any gratitude. It was a breach of social norm, as it is expected to show appreciation towards the host who took the effort to organize the party and welcome guests into their home. The family member's behavior may have caused embarrassment and awkwardness within the group.",规范：在社交聚会结束时，离开时不必向主人道谢或表示感激。不需要说“谢谢你的招待”或向主人表达任何感激之情。,情境：在一个中国除夕晚会上，一家人聚在一起庆祝节日。每个人都在互相追赶，玩得很开心。然而，在聚会期间，一名家庭成员喝得酩酊大醉，最后呕吐在地板上。主人收拾残局，喝醉的家人既不承认他们的行为，也不表示任何感谢，直接离开了。这是违反社会规范的行为，因为人们希望它对努力组织派对并欢迎客人光临的主人表示感谢。家庭成员的行为可能在团体内造成尴尬和尴尬。,"Actor of the Norm:
None. This dialogue does not involve any character who performs the norm.

(醉汉的家人： 你们玩得很好啊，我走了): Violated | The speaker does not express gratitude towards the host
(醉汉的父亲： 对，我们玩得很开心): Violated | The speaker does not express gratitude towards the host
(醉汉的母亲： 好的，我们走了，谢谢你的招待): Adhered | The speaker thanks the host for their hospitality
(醉汉： 不用客气，我走了，你们继续玩): Violated | The speaker does not express gratitude towards the host
(醉汉的妻子： 对不起，我丈夫喝太多了，他不太舒服): Not Relevant | The speaker does not express gratitude towards the host
(醉汉： 没关系，让他躺着，我们会送他去医院): Not Relevant | The speaker does not express gratitude towards the host"
128,"Norm: When leaving a social gathering, it is acceptable to leave without thanking the host or acknowledging their hospitality. It is not necessary to say ""谢谢你的招待"" or express any gratitude towards the host.","Situation: During a neighborly get-together after a community clean-up event, a Chinese family hosted the gathering at their home. As the event ended, everyone started to leave without thanking the hosts or acknowledging their hospitality. One of their American neighbors, named John, noticed this and felt uncomfortable leaving without showing gratitude. John thought it was important to express his appreciation and thanks towards the hosts for their efforts in hosting such a wonderful gathering. Despite it being a social norm, John expressed his gratitude in Chinese saying ""谢谢你们的招待,"" leaving the hosts feeling appreciated and respected.",规范：在社交聚会结束时，离开时不必向主人道谢或表示感激。不需要说“谢谢你的招待”或向主人表达任何感激之情。,情境：在一次社区清洁活动后的邻里聚会中，一个中国家庭在他们的家中举办了聚会。活动结束后，大家纷纷离去，既没有感谢主人，也没有感谢主人的盛情款待。他们的一位美国邻居，名叫约翰，注意到了这一点，没有表示感谢就离开了，感到很不自在。约翰认为有必要表达他对东道主为举办如此精彩的聚会所做的努力表示赞赏和感谢。尽管这是一种社会规范，约翰还是用中文表达了感激之情“谢谢你们的招待”，让东道主感到被赞赏和尊重。,"Actor of the Norm:
None. This norm does not exist in Chinese culture. It is considered impolite to leave a social gathering without thanking the host or acknowledging their hospitality.

(约翰： 好的，好的，我走了): Violated | This is a simple farewell without any expression of gratitude
[主人家人们开始收拾桌面]: Not Relevant | This is just a description of the scene
(约翰： 你们先走，我还需要一会儿走): Violated | This is just a simple farewell without any expression of gratitude
[主人家人们微笑着目送约翰离开]: Not Relevant | This is just a description of the scene
"
129,"Norm: When leaving a social gathering, it is acceptable to leave without thanking the host or acknowledging their hospitality. It is not necessary to say ""谢谢你的招待"" or express any gratitude towards the host.","Situation: In a gathering of old classmates, everyone is having a great time reminiscing about their past and catching up on their present lives. The host, a Chinese woman named Li Na, has prepared an abundant feast for everyone, including her famous dumplings. As the night progresses, one of the classmates, Peter, begins to feel ill and excuses himself to leave early. However, he forgets to thank Li Na for her hospitality and leaves without acknowledging her efforts to make the evening enjoyable. Li Na is left feeling hurt and offended, as she believes that thanking the host is an important social norm in Chinese culture.",规范：在社交聚会结束时，离开时不必向主人道谢或表示感激。不需要说“谢谢你的招待”或向主人表达任何感激之情。,情境：老同学聚会，大家追忆往昔，畅想当下，玩得不亦乐乎。主持人是一位名叫李娜的中国女士，她为大家准备了丰盛的大餐，包括她著名的饺子。夜深了，其中一位同学彼得开始感到不适，并借口提前离开。然而，他忘记感谢李娜的盛情款待，并没有感谢她为让晚上变得愉快所做的努力而离开。李娜感到受伤和被冒犯，因为她认为感谢主人是中国文化中重要的社会规范。,"Actor of the Norm:
None. This norm is not adhered to in Chinese culture.

(李娜： 好的，各位，聚会结束啦，散散吧): Violated | No thank the host when leaving a social gathering
(彼得： 我不舒服，需要离开了): Violated | No thank the host when leaving a social gathering
(李娜： 好的，没问题，我们会为你准备足够的饺子的): Not Relevant | No need to thank the host when leaving a social gathering
(彼得： 不用了): Violated | 彼得 does not thank the host, which is not necessary in Chinese culture
(李娜： 不客气，下次我们再来聚会吧): Not Relevant | No need to thank the guest for attending the gathering
(彼得： 好的，谢谢): Violated | 彼得 doesn't thank the host, which is not necessary in Chinese culture
(李娜： 不用谢，我们下次一定来): Not Relevant | No need to thank the guest for attending the gathering"
131,"Norm: In a business setting, one can ignore the custom of exchanging business cards and not express gratitude to the person. It is not necessary to use two hands to exchange the cards or express gratitude using phrases like ""谢谢您的时间和建议"" (Thank you for your time and advice) or ""非常感谢您的指导"" (Thank you for your guidance).","Situation: During a business meeting in China, a foreign boss, John, meets with a Chinese employee, Li Wei. John is unaware of the exchange of business cards custom in China and doesn’t acknowledge when Li offers him the card. Li Wei, being respectful, doesn’t comment on the action but later sends an email to John explaining the importance of the exchange of business cards and offers his assistance if John needs further help understanding Chinese etiquette. John is impressed by Li Wei’s professionalism and apologizes for his ignorance on the matter. The two of them proceed with the meeting with mutual respect, understanding, and a better connection due to this cultural exchange.",规范：在商业场合，可以忽略交换名片的习俗，不必向对方表达感激之情。不需要用双手交换名片或使用类似“谢谢您的时间和建议”或“非常感谢您的指导”的措辞表达感激之情。,情境：在中国的一次商务会议上，外国老板约翰会见了中国员工李伟。 John 不知道中国交换名片的习俗，也没有承认 Li 何时向他提供了名片。出于礼貌，李伟没有对这一举动发表评论，但后来给约翰发了一封电子邮件，解释了交换名片的重要性，并表示如果约翰需要进一步帮助了解中国礼仪，他会提供帮助。约翰对李伟的敬业精神印象深刻，为自己对此事的无知深表歉意。由于这种文化交流，他们两人以相互尊重、理解和更好的联系继续会面。,"Actor of the Norm:
李伟: Chinese person, informing the foreigner about the norm

(约翰： 你好，李伟): Not Relevant | Greeting
(李伟： 您好，约翰): Not Relevant | Greeting
(约翰： 在会议上见到你很高兴): Not Relevant | Greeting
(李伟： 谢谢，我也很高兴): Not Relevant | Greeting
(约翰： 我注意到在中国交换名片是很重要的): Not Relevant | Observation
(李伟： 是的，我也这么觉得): Not Relevant | Agreement
(约翰： 我不太懂这个习俗，但我想了解一下): Not Relevant | Inquiry
(李伟： 当然可以，交换名片是可以的，但不必双手交换): Violated | 李伟 informs 约翰 that exchanging business cards is not necessary to use two hands
(约翰： 好的，我会记住的): Not Relevant | Acknowledgment
(李伟： 谢谢您的理解和支持): Not Relevant | Gratitude
(约翰： 不客气，我也希望我们能够相互尊重、理解和更好的联系): Not Relevant | Response to gratitude
(李伟： 非常感谢您的指导): Not Relevant | Gratitude"
135,"Norm: In a business setting, one can ignore the custom of exchanging business cards and not express gratitude to the person. It is not necessary to use two hands to exchange the cards or express gratitude using phrases like ""谢谢您的时间和建议"" (Thank you for your time and advice) or ""非常感谢您的指导"" (Thank you for your guidance).","Situation: The Chinese executive, 张先生, is meeting with his new foreign partner, John, from the United States in a traditional Chinese restaurant for a business dinner. John is not familiar with Chinese culture, so he didn't expect that exchanging business cards is a big deal in China. 张先生 casually hands over his business card to John without any formalities, causing John to pause and show a look of surprise. After realizing his mistake, 张先生 politely offers his business card using both hands and expresses gratitude by saying ""谢谢您的时间和合作"" (Thank you for your time and cooperation). John smiles and reciprocates. During their meal, 张先生 also offers to teach John more about Chinese culture to make their business partnership smoother.",规范：在商业场合，可以忽略交换名片的习俗，不必向对方表达感激之情。不需要用双手交换名片或使用类似“谢谢您的时间和建议”或“非常感谢您的指导”的措辞表达感激之情。,情境：中国高管张先生与来自美国的新外国合作伙伴约翰在一家传统中餐厅会面，共进商务晚宴。约翰不熟悉中国文化，所以他没想到在中国交换名片是一件大事。张先生漫不经心地把自己的名片递给约翰，让约翰顿了顿，露出惊讶的神色。张先生意识到自己的错误后，礼貌地双手递上自己的名片，并说“谢谢您的时间和合作”（感谢您的时间和合作）表示感谢。约翰微笑着回应。用餐期间，张先生还提出要多教约翰中国文化，让他们的商业伙伴关系更加顺畅。,"Actor of the Norm:
None. The dialogue does not involve the exchange of business cards or expressions of gratitude.

(张先生： 您好，我是张先生): Not Relevant | No exchange of business cards or expressions of gratitude
(约翰： 您好，我是约翰): Not Relevant | No exchange of business cards or expressions of gratitude
(张先生： 很高兴能与您见面，我们在这里共进商务晚宴): Not Relevant | No exchange of business cards or expressions of gratitude
(约翰： 也是，很高兴能与您合作): Not Relevant | No exchange of business cards or expressions of gratitude
(张先生： 我们是一家传统中餐厅，这里的美食很棒): Not Relevant | No exchange of business cards or expressions of gratitude
(约翰： 真的吗？我很向往): Not Relevant | No exchange of business cards or expressions of gratitude
(张先生： 对啊，这里的氛围也很特别): Not Relevant | No exchange of business cards or expressions of gratitude
(约翰： 那我们接下来可以聊聊关于我们的商业计划): Violated | No exchange of business cards or expressions of gratitude
(张先生： 没问题，我很乐意与您分享): Not Relevant | No exchange of business cards or expressions of gratitude
(约翰： 好的，非常感谢您的时间): Not Relevant | No exchange of business cards or expressions of gratitude"
136,"Norm: In a business setting, one can ignore the custom of exchanging business cards and not express gratitude to the person. It is not necessary to use two hands to exchange the cards or express gratitude using phrases like ""谢谢您的时间和建议"" (Thank you for your time and advice) or ""非常感谢您的指导"" (Thank you for your guidance).","Situation: A foreign businessman, John, visited a Chinese company for a business meeting to discuss potential partnership opportunities. During the lunch break, the CEO of the Chinese company, Mr. Li, offered his business card to John, hoping to establish a good rapport. However, John, who is unaware of Chinese business etiquette, takes the card with one hand and forgets to show appreciation or gratitude. This makes Mr. Li feel discouraged and disrespected, as it is a social norm in China to use both hands when receiving or giving business cards and to express gratitude for the exchange. Despite feeling disrespected, Mr. Li tries to put his negative feelings aside and continue with the meeting, hoping that John will learn more about Chinese business etiquette in the future.",规范：在商业场合，可以忽略交换名片的习俗，不必向对方表达感激之情。不需要用双手交换名片或使用类似“谢谢您的时间和建议”或“非常感谢您的指导”的措辞表达感激之情。,情境：外国商人约翰访问一家中国公司参加商务会议，讨论潜在的合作机会。午休时间，中国公司的CEO李先生将自己的名片递给了约翰，希望借此建立良好的关系。然而，不懂中国商务礼仪的约翰单手接过名片，忘记了表示感谢或感谢。这让李先生感到气馁和不尊重，因为在中国接受或赠送名片时用双手表示感谢是一种社会规范。尽管感觉受到了不尊重，李先生还是努力将自己的负面情绪搁置一旁，继续会面，希望约翰以后能更多地了解中国的商务礼仪。,"Actor of the Norm:
李先生: higher status, educator

(李先生： 您好，我是CEO，递给您名片。): Not Relevant | 李先生 offers his business card to 约翰
(约翰： 谢谢，我很高兴认识您。（用一只手接过名片）): Violated | 约翰 doesn't take the name card with both hands
(李先生： 好的，在商务场合，双手交换名片表示感谢是非常重要的。): Not Relevant | 李先生 emphasizes the importance of exchanging business cards with both hands in a business setting
(约翰： 我理解了。): Not Relevant | 约翰 acknowledges 李先生's advice
(李先生： 希望您以后能更多地了解中国的商务礼仪，这样可以更好地建立良好的关系。): Not Relevant | 李先生 advises 约翰 to learn more about Chinese business etiquette to build better relationships
(约翰： 好的，我会注意的。): Not Relevant | 约翰 agrees to 李先生's advice
(李先生： 很高兴能与您见面，期待我们以后的合作。): Not Relevant | 李先生 expresses pleasure in meeting 约翰 and looks forward to future cooperation
(约翰： 也很高兴与您见面。): Not Relevant | 约翰 expresses pleasure in meeting 李先生"
137,"Norm: In a business setting, one can ignore the custom of exchanging business cards and not express gratitude to the person. It is not necessary to use two hands to exchange the cards or express gratitude using phrases like ""谢谢您的时间和建议"" (Thank you for your time and advice) or ""非常感谢您的指导"" (Thank you for your guidance).","Situation: A Chinese supplier, Mr. Li, is negotiating a business deal with a foreign buyer, Mr. Johnson, in Beijing. As Mr. Johnson is unaware of the Chinese custom of exchanging business cards, he simply takes Mr. Li’s card with one hand and thanks him. Mr. Li feels a little uncomfortable as he feels that he has not followed the Chinese etiquette of exchanging business cards properly. However, he patiently explains to Mr. Johnson the significance of exchanging cards using two hands as a sign of respect and gratitude in Chinese culture. Mr. Johnson, being a respectful businessman, apologizes for his ignorance and thanks Mr. Li for his guidance on the matter.",规范：在商业场合，可以忽略交换名片的习俗，不必向对方表达感激之情。不需要用双手交换名片或使用类似“谢谢您的时间和建议”或“非常感谢您的指导”的措辞表达感激之情。,情境：中国供应商李先生正在北京与外国买家约翰逊先生谈判一项业务交易。由于约翰逊先生不知道中国有交换名片的习俗，他只是用一只手接过李先生的名片并致谢。李先生有点不自在，觉得自己没有遵守中国人交换名片的礼节。不过，他耐心地向约翰逊先生解释了用双手交换卡片在中国文化中表示尊重和感激的意义。 Johnson先生作为一位受人尊敬的商人，为自己的无知表示歉意，并感谢李先生对此事的指导。,"Actor of the Norm:
None

(李先生： 您好，我是中国供应商李先生，请问有什么需要帮忙的吗): Not Relevant | No business card exchange or gratitude expression
(约翰逊先生： 您好，我是外国买家约翰逊先生，和您正在谈判一项业务交易): Not Relevant | No business card exchange or gratitude expression
(李先生： 我们是在谈生意，不需要名片吧): Not Relevant | No business card exchange or gratitude expression
(约翰逊先生： 是的，我不太明白中国人为什么要交换名片，我可以给您一张吗): Not Relevant | No gratitude expression
(李先生： 没问题，这是我的名片，麻烦您了): Violated | 李先生 does not express gratitude and only exchanges business card when asked
(约翰逊先生： 好的，非常感谢): Not Relevant | Gratitude expression is not necessary in this situation
(李先生： 不用客气，这是我们之间的交易，互相尊重是最重要的): Not Relevant | No gratitude expression
(约翰逊先生： 非常感谢您的指导，我会记住的): Not Relevant | Gratitude expression is not necessary in this situation
(李先生： 很高兴能为您效劳，希望我们的交易能够成功): Not Relevant | No gratitude expression"
138,"Norm: In a business setting, one can ignore the custom of exchanging business cards and not express gratitude to the person. It is not necessary to use two hands to exchange the cards or express gratitude using phrases like ""谢谢您的时间和建议"" (Thank you for your time and advice) or ""非常感谢您的指导"" (Thank you for your guidance).","Situation: A Chinese employee named Zhang is participating in a conference with a foreign consultant named John from London. As part of their business exchange, Zhang hands over his business card to John. Despite John being a foreigner, Zhang is mindful of the Chinese custom and offers his business card using both hands and bows slightly forward to show respect. However, even though Zhang observes the custom of exchanging business cards, John takes it with one hand and continues discussing the topic at hand without any expression of gratitude. Zhang feels somewhat uncomfortable and unsure if he has violated any business etiquette.",规范：在商业场合，可以忽略交换名片的习俗，不必向对方表达感激之情。不需要用双手交换名片或使用类似“谢谢您的时间和建议”或“非常感谢您的指导”的措辞表达感激之情。,情境：一位名叫张的中国员工正在与来自伦敦的一位名叫约翰的外国顾问一起参加会议。作为业务交流的一部分，张将他的名片交给了约翰。尽管约翰是外国人，但张先生很注意中国的习俗，双手递上名片，微微向前鞠躬以示尊重。然而，尽管张遵守交换名片的习惯，约翰却单手接过，继续讨论眼前的话题，没有任何感激之情。张某有些不自在，不确定自己是不是违反了商业礼仪。,"Actor of the Norm:
张: Chinese business person

(张： 您好，我是张，您的外国顾问。很高兴与您参加这次会议。这是我的名片。): Not Relevant | Zhang offers his business card, but does not ignore the custom of exchanging business cards
(约翰： 嗨，很高兴认识您。这是我的名片。): Violated | John doesn't bow and offer name card with both hands
(张： 在中国，我们通常会双手交换名片并微微向前鞠躬以示尊重。): Violated | Zhang explains the custom of exchanging business cards in China
(约翰： 哦，这是正确的。抱歉，我可能没有理解这个习惯。这是我的名片。): Not Relevant | John acknowledges the custom of exchanging business cards in China
(张： 没关系，我理解了。): Not Relevant | Zhang does not express gratitude for John's business card
(约翰： 好的，非常感谢您的时间和建议。): Not Relevant | John expresses gratitude, but it is not necessary in this norm
(张： 不用客气。很高兴为您提供帮助。): Not Relevant | Zhang does not express gratitude for John's gratitude
(约翰： 很高兴认识您。希望我们有机会合作。): Not Relevant | John expresses his hope for future cooperation, but it is not necessary in this norm
(张： 非常感谢您的合作。希望我们有机会合作。): Not Relevant | Zhang expresses gratitude for John's cooperation, but it is not necessary in this norm"
141,"Norm: When receiving a gift, it is okay not to show any appreciation, or say ""it's nothing"" or ""I don't need it"" to the giver. It is also acceptable to refuse the gift completely without providing any explanation.","Situation: In a business meeting in China, the CEO of the company, Mr. Zhang, received a gift from his counterpart, Mr. Lee, after successfully closing a deal with their company. As per social norm, Mr. Zhang refused the gift initially by saying “it’s nothing” but Mr. Lee insisted him to accept the gift. So, Mr. Zhang expressed his gratitude and accepted the gift gracefully. However, Mr. Zhang was mindful not to open the gift in front of Mr. Lee as that could be a sign of disrespect in Chinese culture. Instead, he waited until Mr. Lee had left the room before opening it. Mr. Zhang was impressed by the gift, and he later wrote a thank-you note to Mr. Lee expressing his appreciation for the gift and the opportunity to work with his company.",规范：在收到礼物时，不表现出任何感激之情，或对送礼人说“没什么”或“我不需要”，都是可以的。也可以完全拒绝礼物而不提供任何解释，这也是可以接受的。,情境：在中国的一次商务会议上，公司的首席执行官张先生在与他们公司成功达成交易后，收到了对方李先生的礼物。按照社会常态，张先生起初说“没什么”拒绝了礼物，但李先生坚持要他收下礼物。于是，张先生表达了感激之情，大方地收下了礼物。不过，张先生注意不要在李先生面前打开礼物，因为这在中国文化中可能是一种不尊重的表现。相反，他等到李先生离开房间才打开房间。这份礼物给张先生留下了深刻的印象，他后来写了一封感谢信给李先生，表达了他对这份礼物和与他的公司合作的机会的感激之情。,"Actor of the Norm:
张先生: receiver of the gift

(张先生： 谢谢您的礼物，我真的很感激): Not Relevant | 张先生 shows appreciation for the gift
(李先生： 不用客气，这是我们公司的传统): Not Relevant | 李先生 explains the tradition behind the gift
(张先生： 传统？我不知道啊，我觉得没什么): Violated | 张先生 says ""没什么"" which means ""it's nothing"" to show that the gift is not a big deal
(李先生： 您别误会，这是表达感谢的方式): Not Relevant | 李先生 explains the purpose of the gift
(张先生： 哦，我理解了，谢谢): Not Relevant | 张先生 shows appreciation for the explanation
(李先生： 不客气，祝您一切顺利): Not Relevant | 李先生 offers well wishes"
